#,Name of scholarship,Degree Type,Deadline,Country ,Scholarship Coverage,Language Proficiency,Other relevant notes,Application Link
121,Development-Related Postgraduate Courses (EPOS) • DAAD,"Master's, PhD",varies,Germany,"stipend or maintenance (monthly/annually), health allowance, travel allowance",Depends on university or degree program,"Funds postgraduate courses in Germany on this list: https://static.daad.de/media/daad_de/pdfs_nicht_barrierefrei/in-deutschland-studieren-forschen-lehren/daad_epos_-_deadlines_2025_26.pdf 

Value: Depending on academic level, monthly payments of 992 euros for graduates or 1,300 euros for doctoral candidates
Payments towards health, accident and personal liability insurance cover
Travel allowance, unless these expenses are covered by the home country or another source of funding
Under certain circumstances, scholarship holders may receive the following additional benefits:
Monthly rent subsidy
Monthly allowance for accompanying members of family",https://static.daad.de/media/daad_de/pdfs_nicht_barrierefrei/in-deutschland-studieren-forschen-lehren/daad_epos_-_deadlines_2025_26.pdf
122,Scholarships and Fellowships – Dutch Scholars for Palestine,"Bachelor's, Master's",Varies,Netherlands,,,Specifically for Palestinians interested in Dutch academia,https://www.dutchscholarsforpalestine.nl/scholarships-and-fellowships-palestine
123,E-JUST Scholarship and Financial Aid,"Bachelor's, Master's",Varies,Egypt,,,Targeting exceptional students; scholarships for merit,https://www.ejust.edu.eg/ug-scholarships
124,Bseisu Foundation Scholarships,Master's,"Varies because Beisu offers many different fellowships, but they all look closed","UK, US, Palestine, Malaysia",full tuition,Depends on university or degree program,"The Bseisu Foundation offers different scholarships and funding opportunities across the UK, US, Middle East and Malaysia.",https://www.bseisufoundation.org/other-funding-opportunities and https://www.bseisufoundation.org/scholarships 
125,Erasmus Mundus,Master's,Varies because Erasmus Mundus offers many different degree programs at universities across Europe,Europe,"full tuition, health allowance, stipend or maintenance (monthly/annually), travel allowance",Depends on university or degree program,"Erasmus Mundus Joint Masters are prestigious international masters, jointly designed and delivered by a group of higher education institutions. They involve at least 3 institutions from at least 3 different countries, and multiple associated partners from the academic and non-academic world. Typically, they include periods of study, research, traineeship, thesis preparation and defence. 

You can view the website to find programs that suit your interests. 

Some programs require language proficiency in languages other than English. Check each individual program for exact details on scholarship coverage.","Erasmus Mundus Joint Masters are prestigious international masters, jointly designed and delivered by a group of higher education institutions. They involve at least 3 institutions from at least 3 different countries, and multiple associated partners from the academic and non-academic world. Typically, they include periods of study, research, traineeship, thesis preparation and defence. 

You can view the website to find programs that suit your interests.

Some programs require language proficiency in languages other than English. Check each individual program for exact details on scholarship coverage."
126,UWL PhD Opportunities,PhD,Varies by program,UK,full tuition,"TOEFL, IELTS",,https://www.uwl.ac.uk/research/phd-opportunities
127,Graduate Research Scholarships,"Master's, PhD",Varies; apply by the deadline for chosen course of study and you will be automatically considered for this scholarship,Australia ,"full tuition, stipend or maintenance (monthly/annually), health allowance, travel allowance",unclear,University of Melbourne,https://scholarships.unimelb.edu.au/awards/graduate-research-scholarships
128,Khalifa University of Science and Technology,"Master's, PhD",,UAE,"full tuition, accommodation, health allowance, travel allowance, visa cost",,Stipend of 20000 AED if you are a PhD student,https://www.ku.ac.ae/scholarships-postgraduate#international-students
129,Sijal Palestine Scholarship,Certificate Program,,Jordan,full tuition,,"Palestine Scholarships are awarded to students involved in peaceful, non-violent movements for Palestinian freedom and liberation, with a priority to those students who have faced violence or suspension as a result of their activism",https://www.sijal.org/palestine-scholarship
130,Gazan Women's Scholarship,"Bachelor's, Master's",,Canada,"full tuition, health allowance, travel allowance, stipend or maintenance (monthly/annually), accommodation",,"You must have been registered in a university in Gaza on October 6, 2023, and you must currently reside in Egypt.",https://docs.google.com/forms/d/e/1FAIpQLSdru8l9indOt-Wbo1H_KHZNSFbT1QPriswMZp4SYrKqP2sr-A/viewform
131,Data Camp ,Online,,,,,,
132,McCall McBain Scholars,Master's,closed for 2026/2027,Canada,"full tuition, travel allowance, stipend or maintenance (monthly/annually)","IELTS, TOEFL","McGill University. In addition to Master's degrees, the following ""second-entry professional undergraduate degrees"" are eligible: BCL/JD (Law), DMD (Dentistry), MDCM (Medicine)",https://mccallmacbainscholars.org/
133,Bseisu-UCL Scholarship,Master's,Typically late April,UK,"full tuition, stipend or maintenance (monthly/annually)",Depends on university or degree program,"Students from Lebanon, Jordan, Palestine, Syria; strong academic merit, financial need",https://www.ucl.ac.uk/scholarships/bseisu-ucl-scholarship
134,MTCP Scholarship,Master's,18-Jun-2025,Malaysia,"full tuition, stipend or maintenance (monthly/annually), travel allowance","Depends on university or degree program, TOEFL, IELTS",Open to citizens of developing countries with work experience and strong academic merit,https://mtcp.kln.gov.my/scholarship
135,CRUI–MAECI Italian University Scholarships for Palestinians,Master's,variable -,Italy,"full tuition, stipend or maintenance (monthly/annually), accommodation",,Note: deadlines for language course in early May. University deadlines differ,https://www.crui.it/home-ri/iupals-italian-universities-for-palestinian-students.html
136,NAWA Banach Scholarship,Master's,8-May-2026,Poland,"full tuition, stipend or maintenance (monthly/annually)",,Note: call opened 13/04,https://nawa.gov.pl/en/students/foreign-students/the-banach-scholarship-programme/about-the-programme
